query,lang
高壓滅菌鍋,zh-TW
高壓蒸氣滅菌器,zh-TW
滅菌鍋使用方法,zh-TW
高壓滅菌鍋 溫度,zh-TW
滅菌鍋 維護保養,zh-TW
高壓滅菌鍋的工作原理是什麼,zh-TW
高壓滅菌鍋和傳統滅菌方式的比較,zh-TW
如何維護高壓滅菌鍋以延長使用壽命,zh-TW
高壓滅菌鍋常見故障及排查方法,zh-TW
如何校正高壓滅菌鍋的壓力,zh-TW
高壓滅菌鍋的使用注意事項有哪些,zh-TW
市場上有哪些高壓滅菌鍋品牌推薦,zh-TW
高壓滅菌鍋的配件有哪些需要定期更換,zh-TW
高壓滅菌鍋的使用手冊在哪裡可以下載,zh-TW
高壓滅菌鍋的價格範圍大約是多少,zh-TW
高壓滅菌鍋的替代品有哪些選擇,zh-TW
如何選擇適合的高壓滅菌鍋型號,zh-TW
高壓滅菌鍋的清潔與消毒方法,zh-TW
高壓滅菌鍋的安全操作規範,zh-TW
高壓滅菌鍋故障顯示燈的含義,zh-TW
高壓滅菌鍋的滅菌時間應該如何設定,zh-TW
使用高壓滅菌鍋時如何避免常見錯誤,zh-TW
高壓滅菌鍋與烘箱滅菌的效果比較,zh-TW
高壓滅菌鍋的維修服務如何選擇,zh-TW
高壓滅菌鍋的使用技巧與建議,zh-TW
